"\"Grommets (ventilation tubes) for recurrent acute otitis media in children\",\"BACKGROUND: Acute otitis media (AOM) is one of the most common childhood illnesses. While many children experience sporadic AOM episodes, an important group suffer from recurrent AOM (rAOM), defined as three or more episodes in six months, or four or more in one year. In this subset of children AOM poses a true burden through frequent episodes of ear pain, general illness, sleepless nights and time lost from nursery or school. Grommets, also called ventilation or tympanostomy tubes, can be offered for rAOM. OBJECTIVES: To assess the benefits and harms of bilateral grommet insertion with or without concurrent adenoidectomy in children with rAOM. SEARCH METHODS: The Cochrane ENT Information Specialist searched the Cochrane ENT Trials Register; CENTRAL; MEDLINE; EMBASE; CINAHL; Web of Science; ClinicalTrials.gov; ICTRP and additional sources for published and unpublished trials. The date of the search was 4 December 2017. SELECTION CRITERIA: Randomised controlled trials (RCTs) comparing bilateral grommet insertion with or without concurrent adenoidectomy and no ear surgery in children up to age 16 years with rAOM. We planned to apply two main scenarios: grommets as a single surgical intervention and grommets as concurrent treatment with adenoidectomy (i.e. children in both the intervention and comparator groups underwent adenoidectomy). The comparators included active monitoring, antibiotic prophylaxis and placebo medication. DATA COLLECTION AND ANALYSIS: We used the standard methodological procedures expected by Cochrane. Primary outcomes were: proportion of children who have no AOM recurrences at three to six months follow-up (intermediate-term) and persistent tympanic membrane perforation (significant adverse event). Secondary outcomes were: proportion of children who have no AOM recurrences at six to 12 months follow-up (long-term); total number of AOM recurrences, disease-specific and generic health-related quality of life, presence of middle ear effusion and other adverse events at short-term, intermediate-term and long-term follow-up. We used GRADE to assess the quality of the evidence for each outcome; this is indicated in italics. MAIN RESULTS: Five RCTs (805 children) with unclear or high risk of bias were included. All studies were conducted prior to the introduction of pneumococcal vaccination in the countries' national immunisation programmes. In none of the trials was adenoidectomy performed concurrently in both groups.Grommets versus active monitoringGrommets were more effective than active monitoring in terms of:- proportion of children who had no AOM recurrence at six months (one study, 95 children, 46% versus 5%; risk ratio (RR) 9.49, 95% confidence interval (CI) 2.38 to 37.80, number needed to treat to benefit (NNTB) 3; low-quality evidence);- proportion of children who had no AOM recurrence at 12 months (one study, 200 children, 48% versus 34%; RR 1.41, 95% CI 1.00 to 1.99, NNTB 8; low-quality evidence);- number of AOM recurrences at six months (one study, 95 children, mean number of AOM recurrences per child: 0.67 versus 2.17, mean difference (MD) -1.50, 95% CI -1.99 to -1.01; low-quality evidence);- number of AOM recurrences at 12 months (one study, 200 children, one-year AOM incidence rate: 1.15 versus 1.70, incidence rate difference -0.55, 95% -0.17 to -0.93; low-quality evidence).Children receiving grommets did not have better disease-specific health-related quality of life (Otitis Media-6 questionnaire) at four (one study, 85 children) or 12 months (one study, 81 children) than those managed by active monitoring (low-quality evidence).One study reported no persistent tympanic membrane perforations among 54 children receiving grommets (low-quality evidence).Grommets versus antibiotic prophylaxisIt is uncertain whether or not grommets are more effective than antibiotic prophylaxis in terms of:- proportion of children who had no AOM recurrence at six months (two studies, 96 children, 60% versus 35%; RR 1.68, 95% CI 1.07 to 2.65, I2 = 0%, fixed-effect model, NNTB 5; very low-quality evidence);- number of AOM recurrences at six months (one study, 43 children, mean number of AOM recurrences per child: 0.86 versus 1.38, MD -0.52, 95% CI -1.37 to 0.33; very low-quality evidence).Grommets versus placebo medicationGrommets were more effective than placebo medication in terms of:- proportion of children who had no AOM recurrence at six months (one study, 42 children, 55% versus 15%; RR 3.64, 95% CI 1.20 to 11.04, NNTB 3; very low-quality evidence);- number of AOM recurrences at six months (one study, 42 children, mean number of AOM recurrences per child: 0.86 versus 2.0, MD -1.14, 95% CI -2.06 to -0.22; very low-quality evidence).One study reported persistent tympanic membrane perforations in 3 of 76 children (4%) receiving grommets (low-quality evidence).Subgroup analysisThere were insufficient data to determine whether presence of middle ear effusion at randomisation, type of grommet or age modified the effectiveness of grommets. AUTHORS' CONCLUSIONS: Current evidence on the effectiveness of grommets in children with rAOM is limited to five RCTs with unclear or high risk of bias, which were conducted prior to the introduction of pneumococcal vaccination. Low to very low-quality evidence suggests that children receiving grommets are less likely to have AOM recurrences compared to those managed by active monitoring and placebo medication, but the magnitude of the effect is modest with around one fewer episode at six months and a less noticeable effect by 12 months. The low to very low quality of the evidence means that these numbers need to be interpreted with caution since the true effects may be substantially different. It is uncertain whether or not grommets are more effective than antibiotic prophylaxis. The risk of persistent tympanic membrane perforation after grommet insertion was low.Widespread use of pneumococcal vaccination has changed the bacteriology and epidemiology of AOM, and how this might impact the results of prior trials is unknown. New and high-quality RCTs of grommet insertion in children with rAOM are therefore needed. These trials should not only focus on the frequency of AOM recurrences, but also collect data on the severity of AOM episodes, antibiotic consumption and adverse effects of both surgery and antibiotics. This is particularly important since grommets may reduce the severity of AOM recurrences and allow for topical rather than oral antibiotic treatment.\""
"\"Tympanostomy Tube Insertion for Otitis Media in Children: A Systematic Review\",\"This SBU report reviews the scientific evidence for tympanostomy tube insertion in the tympanic membrane (eardrum) of children with recurrent acute otitis media (inflammation of the middle ear) or long-term episodes of secretory otitis media (with fluid accumulation in the middle ear). Although these conditions eventually heal, approximately 10,000 Swedish children a year have such severe problems due to episodes of pain, reduced quality of life or hearing loss that tympanostomy tube insertion is considered to be warranted. Conclusions The systematic literature review, along with a survey of clinical practice, generated the following conclusions.The scientific evidence for tympanostomy tube insertion in children with recurrent acute otitis media is insufficient. Given that more than 2,000 Swedish children a year receive the treatment for this indication, reliable studies are needed as soon as possible. Tympanostomy tube insertion for long-term secretory otitis media improves hearing (strong scientific evidence) and quality of life (moderately strong scientific evidence) for at least 9 months. Treating children with this indication in such a manner is justified if they have objectively verified hearing loss and accompanying reduction in quality of life. Forms that have been tested for children with diseases of the ear can be used to assess quality of life. Adenoidectomy improves hearing at 6-month follow-up as effectively as tympanostomy tube insertion in children with long-term secretory otitis media (limited scientific evidence). Combining tympanostomy tube insertion with adenoidectomy does not lead to further hearing improvement at 3-month follow up (moderately strong scientific evidence). Suctioning out fluid in the middle ear in combination with tympanostomy tube insertion does not extend functionality or reduce obstruction of the tube. Routine removal of tubes that are not spontaneously discharged has not been shown to reduce the risk of complications. Bathing and swimming do not increase the risk of tympanostomy tube otorrhoea (discharge) (limited scientific evidence). Preventive measures such as earplugs or eardrops when bathing or swimming have little or no effect (moderately strong scientific evidence). The scientific evidence is insufficient to determine whether tympanostomy tube insertion is cost-effective for recurrent acute otitis media or secretory otitis media.\""
"\"Ventilation tubes after surgery for otitis media with effusion or acute otitis media and swimming. Systematic review and meta-analysis.\",\"OBJECTIVE: To determine if the use of ear protection when swimming of children with ventilation tubes modifies the risk of acute otitis media (AOM) compared to not swimming. METHODS: Systematic review. DATA SOURCES: Search conducted in MEDLINE, EMBASE and The Cochrane Library databases. STUDY SELECTION: Prospective cohort studies and controlled clinical trials of children with ventilation tubes, with a minimum follow-up of 2 months. DATA EXTRACTION: Two reviewers independently assessed trial quality and extracted data. RESULTS: 11 studies were selected. No difference was found in risk of AOM in children who swim without ear protection compared with those who do not swim: Odds ratio=0.78, 95% confidence interval 0.42-1.44; nor compared with those who use earplugs and swimming caps, odds ratio=0.75, 95% confidence interval 0.38-1.48; nor in those who use ear drops after swimming compared with those who used earplugs or swimming caps, odds ratio=0.76, 95% confidence interval 0.56 to 1.02. The use of ear drops after swimming increases the risk of AOM in children with ventilation tubes as compared with those who do not swim, odds ratio=3.14, 95% confidence interval 1.40 to 7.05. CONCLUSIONS: There is no evidence to suggest that protection when swimming with earplugs, swimming caps or ear drops in children with ventilation tubes reduces the risk of AOM. Ear drops may even increase this risk.\""
"\"Acute otitis media in children with tympanostomy tubes.\",\"OBJECTIVE: To review evidence regarding antibiotic treatment of acute otitis media in children with tympanostomy tubes and to discuss antibiotic resistance and ototoxicity. QUALITY OF EVIDENCE: MEDLINE, EMBASE, the Cochrane Database of Systematic Reviews, and the Cochrane Central Register of Controlled Trials were searched for relevant articles. Articles providing level I evidence(randomized controlled trials) for treatment were used. Key words used in the search included otitis media(MeSH), middle ear ventilation (MeSH), tympanostomy tubes, and otorrhea. MAIN MESSAGE: Tympanostomy tube insertion is a common procedure; acute otitis media is a frequent sequela. Treatment options include systemic or topical antibiotics with or without corticosteroids. The development of bacterial resistance to antibiotics and ototoxicity related to treatment are important considerations. There have been well-conducted randomized controlled trials of topical versus systemic antibiotic agents. Combined with proper ear cleaning and tragal pumping, topical fluoroquinolone agents offer the most effective treatment. CONCLUSION: Current evidence suggests that a topical fluoroquinolone, with or without a corticosteroid, is the treatment of choice for acute otitis media with tympanostomy tubes.\""
"\"Which children would benefit most from tympanostomy tubes (grommets)? A personal evidence-based review.\",\"UNLABELLED: Otitis media with effusion (OME) is a common condition in young children. OME causes some hearing loss, and can cause permanent changes in the tympanic membrane as well as other symptoms. In most cases OME is of short duration. As long-lasting bilateral OME for decades has been associated with delayed cognitive and language development, parents and ENT specialists have a positive attitude towards treatment with tympanostomy tubes (TT). METHOD: This personal evidence-based review is build on own observations and research combined with newer studies and guidelines. RESULTS: The review argues for a relatively restrictive treatment policy concerning the use of TT in children with OME without signs or symptoms of impaired social or linguistic function. CONCLUSION: Six months with bilateral OME and significant hearing loss should be present before treatment with TT in otherwise healthy children. At the moment we have no evidence for the subgroups of children excluded from the RCTs, i.e. children with speech/language delays, behaviour and learning problems, or syndromes. Clinicians will need to make their own decisions regarding treatment of such children. The situation just now is that some children are over-treated and some are under-treated. There is an urgent need for prospective cohort studies and randomised studies on children with long-lasting OME in an attempt to characterise the children who would benefit most from TT.\""
"\"Ventilation tube treatment: a systematic review of the literature.\",\"OBJECTIVE: The aim of this review was to study the effectiveness of ventilation tube (VT) treatment in children with secretory otitis media (SOM), assessed by improved hearing, normalized language and quality of life (QoL), and recurrent acute otitis media (rAOM), assessed by number of episodes of AOM and QoL. Data Sources. Cochrane Library, PubMed, and Embase databases were searched for randomized and nonrandomized controlled trials and cohort studies in English, Scandinavian, German, and French languages between 1966 and April 2007. Additional literature was retrieved from reference lists in the articles. REVIEW METHODS: A total of 493 abstracts were evaluated independently by 2 members of the project group, 247 full-text versions were assessed for inclusion criteria and quality using structured evaluation forms, and 63 articles were included in the review. RESULTS AND CONCLUSIONS: This review shows that there is strong scientific evidence (grade 1) that VT treatment of SOM improves hearing for at least 9 months and that QoL is improved for up to 9 months (grade 2 scientific evidence). There was insufficient evidence to support an effect of VT treatment for rAOM. There was also insufficient evidence to determine whether the design or material of the VT or the procedure used for insertion had any influence on the effect; however, there was some evidence (grade 3) that aspiration of secretion at insertion does not prolong VT treatment. Further research is needed to address these issues.\""
"\"A systematic review of the effectiveness of ofloxaxin otic solution for the treatment of suppurative otitis media.\",\"The objectives of the study were to determine the effectiveness and incidence of adverse events of ofloxacin otic solution for suppurative otitis media compared with other treatments. All randomized controlled trials and nonrandomized comparative clinical trials published from 1966 to 2000 using ofloxacin otic solution as one of the interventions were reviewed and data were extracted and analyzed. Eleven clinical trials (9 randomized and 2 nonrandomized) enrolling 1,484 adults and children were finally included in the analysis. Five studies employed clear concealment procedure in the allocation of treatment whereas evaluation of outcome was at least single-blinded in 6 trials. The probability of overall cure rate was higher with 0.3% ofloxacin otic solution than with other topical or systemic antibiotics in 9 of the studies analyzed (OR = 2.67; 95% CI = 2.04, 3.50). Resolution of secondary outcome parameters evaluated at least 1 week after treatment was higher with 0.3% ofloxacin otic solution: resolution of otalgia (4 trials; OR = 2.41; 95% CI = 1.2, 4.82); resolution of otorrhea (11 trials; OR = 2.78; 95% CI = 2.12, 3.65), and bacterial eradication rate (6 trials; OR = 3.86; 95% CI = 2.54, 5.87). A subgroup analysis of 4 studies comparing ofloxacin otic solution with antibiotic- and steroid-containing otic solution showed a higher cure rate for ofloxacin otic solution (OR = 2.73; 95% CI = 1.52, 4.90). Another subgroup analysis on 3 studies comparing ofloxacin otic solution with oral systemic antibiotics showed higher resolution of otorrhea with ofloxacin otic solution (OR = 2.78; 95% CI = 2.12, 3.65). Of 4 studies with data on adverse events, the probability of adverse events was lower with ofloxacin otic solution than with other topical antibiotics (OR = 0.28; 95% CI = 0.19, 0.42). Subgroup analysis showed that 0.3% ofloxacin otic solution showed better results in terms of overall cure rate, resolution of otorrhea, otalgia, bacterial eradication rate and incidence of adverse events. Whether due to chronic suppurative otitis media (CSOM) or draining tympanostomy tube, the overall cure rate (CSOM OR = 4.86; with tympanostomy tube OR = 2.13) and resolution of otorrhea (CSOM OR = 4.42; with tympanostomy tube OR = 1.66) were likewise in favor of 0.3% ofloxacin otic solution. The studies included in this meta-analysis showed generally homogenous results in all clinical and laboratory outcomes analyzed, except for the evaluation of adverse events. The authors conclude that 0.3% ofloxacin otic solution is better than other otic antibiotic drops and other oral antibiotics in terms of overall cure rate and resolution of secondary outcome parameters. Estimates on the beneficial effects of ofloxacin otic solution are limited to the period of study included in this review.\""
"\"Effectiveness of Tympanostomy Tubes for Otitis Media: A Meta-analysis.\",\"CONTEXT: Tympanostomy tube placement is the most common ambulatory surgery performed on children in the United States. OBJECTIVES: The goal of this study was to synthesize evidence for the effectiveness of tympanostomy tubes in children with chronic otitis media with effusion and recurrent acute otitis media. DATA SOURCES: Searches were conducted in Medline, the Cochrane Central Trials Registry and Cochrane Database of Systematic Reviews, Embase, and the Cumulative Index to Nursing and Allied Health Literature. STUDY SELECTION: Abstracts and full-text articles were independently screened by 2 investigators. DATA EXTRACTION: A total of 147 articles were included. When feasible, random effects network meta-analyses were performed. RESULTS: Children with chronic otitis media with effusion treated with tympanostomy tubes compared with watchful waiting had a net decrease in mean hearing threshold of 9.1 dB (95% credible interval: -14.0 to -3.4) at 1 to 3 months and 0.0 (95% credible interval: -4.0 to 3.4) by 12 to 24 months. Children with recurrent acute otitis media may have fewer episodes after placement of tympanostomy tubes. Associated adverse events are poorly defined and reported. LIMITATIONS: Sparse evidence is available, applicable only to otherwise healthy children. CONCLUSIONS: Tympanostomy tubes improve hearing at 1 to 3 months compared with watchful waiting, with no evidence of benefit by 12 to 24 months. Children with recurrent acute otitis media may have fewer episodes after tympanostomy tube placement, but the evidence base is severely limited. The benefits of tympanostomy tubes must be weighed against a variety of associated adverse events.\""
"\"Grommets in otitis media with effusion: an individual patient data meta-analysis.\",\"AIMS: To identify subgroups of children with otitis media with effusion (OME) that might benefit more than others from treatment with ventilation tubes. METHODS: An individual patient data (IPD) meta-analysis on seven randomised controlled trials (n = 1234 children in all), focusing on interactions between treatment and baseline characteristics--hearing level (HL), history of acute otitis media, common colds, attending day-care, gender, age, socioeconomic status, siblings, season, passive smoking, and history of breast feeding. Outcome measures that could be studied were mean time spent with effusion (n = 557), mean hearing levels (n = 557 in studies that randomised children, and n = 180 in studies that randomised ears), and language development (n = 381). RESULTS: In the trials that treated both ears the only significant interaction was between day-care and surgery, occurring where mean hearing level was the outcome measure. None of the other baseline variables showed an interaction effect with treatment that would justify subgrouping. In the trials that treated only one ear, the baseline hearing level showed a significant but not pervasive interaction with treatment-that is, only with a cut-off of 25 dB HL. CONCLUSIONS: The effects of conventional ventilation tubes in children studied so far are small and limited in duration. Observation (watchful waiting) therefore seems to be an adequate management strategy for most children with OME. Ventilation tubes might be used in young children that grow up in an environment with a high infection load (for example, children attending day-care), or in older children with a hearing level of 25 dB HL or greater in both ears persisting for at least 12 weeks.\""
"\"Adenoidectomy for recurrent or chronic nasal symptoms in children\",\"BACKGROUND: Adenoidectomy, surgical removal of the adenoids, is a common ENT operation worldwide in children with recurrent or chronic nasal symptoms. A systematic review on the effectiveness of adenoidectomy in this specific group has not previously been performed. OBJECTIVES: To assess the effectiveness of adenoidectomy versus non-surgical management in children with recurrent or chronic nasal symptoms. SEARCH STRATEGY: We searched the Cochrane Ear, Nose and Throat Disorders Group Trials Register; the Cochrane Central Register of Controlled Trials (CENTRAL); PubMed; EMBASE; CINAHL; Web of Science; BIOSIS Previews; Cambridge Scientific Abstracts; mRCT and additional sources for published and unpublished trials. The date of the most recent search was 30 March 2009. SELECTION CRITERIA: Randomised controlled trials comparing adenoidectomy, with or without tympanostomy tubes, versus non-surgical management or tympanostomy tubes alone in children with recurrent or chronic nasal symptoms. The primary outcome studied was the number of episodes, days per episode and per year with nasal symptoms and the proportion of children with recurrent episodes of nasal symptoms. Secondary outcomes were mean number of episodes, mean number of days per episode and per year, and proportion of children with nasal obstruction alone. DATA COLLECTION AND ANALYSIS: Two authors assessed trial quality and extracted data independently. MAIN RESULTS: Only one study included children scheduled for adenoidectomy because of recurrent or chronic nasal symptoms or middle ear disease. In this study no beneficial effect of adenoidectomy was found. The numbers in this study were, however, small (n = 76) and the quality of the study was moderate. The outcome was improvement in episodes of common colds. The risk differences were non-significant, being 2% (95% CI -18% to 22%) and -11% (95% CI -28% to 7%) after 12 and 24 months, respectively. A second study included children with recurrent acute otitis media (n = 180). As otitis media is known to be associated with nasal symptoms, the number of days with rhinitis was studied as a secondary outcome measure. The risk difference was non-significant, being -4 days (95% CI -13 to 7 days). AUTHORS' CONCLUSIONS: Current evidence regarding the effect of adenoidectomy on recurrent or chronic nasal symptoms or nasal obstruction alone is sparse, inconclusive and has a significant risk of bias. High quality trials assessing the effectiveness of adenoidectomy in children with recurrent or chronic nasal symptoms should be initiated.\""
