"\"Tympanostomy Tubes in Children With Otitis Media\",\"OBJECTIVES: The objectives for the systematic review are to synthesize information on the effectiveness of tympanostomy tubes (TT) in children with chronic otitis media with effusion and recurrent acute otitis media, summarize the frequency of adverse effects or complications associated with TT placement, synthesize information on the necessity for water precautions in children with TT, and assess the effectiveness of available treatments for otorrhea in children who have TT. DATA SOURCES: We conducted literature searches in MEDLINE(®), the Cochrane Central Trials Registry and Cochrane Database of Systematic Reviews, Embase(®), and CINAHL(®). Additionally, we perused the reference lists of published relevant clinical practice guidelines and narrative and systematic reviews, and examined Scientific Information Packages from manufacturers. Citations were independently screened by two researchers. REVIEW METHODS: Each study was extracted by one methodologist and confirmed by at least one other methodologist. Data were extracted into customized forms in the Systematic Review Data Repository (SRDR) online system. All included studies were summarized in narrative form and in summary tables. We conducted random effects meta-analyses of comparative studies that were sufficiently similar in population, interventions, and outcomes, and network meta-analyses to compare treatment alternatives across studies. Specific methods and metrics (summary measures) meta-analyzed were chosen based on available reported study data. The PROSPERO protocol registration number is CRD42015029623. RESULTS AND CONCLUSIONS: The literature search yielded 13,334 citations, of which 172 articles are included in the report. Overall, the evidence suggests that TT placed in children with persistent middle-ear effusion improve hearing at 1 to 3 months compared to watchful waiting, but there is no benefit at 12 to 24 months. TT did not consistently improve language, cognition, behavior, or quality of life. However, evidence is sparse, limiting definitive conclusions, and is applicable only to otherwise healthy children. The current evidence base provides little guidance for the treatment of children with cleft palate or Down syndrome. Children with recurrent acute otitis media may have fewer episodes after TT placement, but the evidence base is limited and there is insufficient evidence to assess the impact on quality of life. The benefits of TT placement must be weighed against a variety of adverse events. There is no compelling evidence for children with TT to avoid swimming or bathing, or use earplugs or bathing caps. Should otorrhea develop, the evidence supports topical treatment rather than oral antibiotics or watchful waiting.\""
"\"Grommets for otitis media with effusion in children with cleft palate: a systematic review.\",\"BACKGROUND AND OBJECTIVE: No consensus has yet been reached with regard to the link between otitis media with effusion (OME), hearing loss, and language development in children with cleft palate. The objective of this study was to address the effectiveness of ventilation tube insertion (VTI) for OME in children with cleft palate. METHODS: A dual review process was used to assess eligible studies drawn from PubMed, Medline via Ovid, Cumulative Index to Nursing and Allied Health Literature, Cochrane Library, and reference lists between 1948 and November 2013. Potentially relevant papers were selected according to the full text of the articles. Relevant data were extracted onto a data extraction sheet. RESULTS: Nine high- or moderate-quality cohort studies were included in this study. VTI was administered in 38% to 53% of the OME cases, and more severe cases appeared more likely to undergo VTI. Compared with conservative forms of management (eg, watchful waiting), VTI has been shown to be beneficial to the recovery of hearing in children with cleft palate and OME. A growing body of evidence demonstrates the benefits of VTI in the development of speech and language in children with cleft palate and OME. These children face a higher risk of complications than those undergoing conservative treatments, the most common of which are eardrum retraction and tympanosclerosis, with an incidence of ∼ 11% to 37%. CONCLUSIONS: This review provides evidence-based information related to the selection of treatment for OME in children with cleft palate. Additional randomized controlled trials are required to obtain bias-resistant evidence capable of reliably guiding treatment decisions. The conclusions in this review are based on underpowered cohort studies and very-low-strength evidence.\""
"\"Surgical Treatments for Otitis Media With Effusion: A Systematic Review.\",\"BACKGROUND AND OBJECTIVE: The near universality of otitis media with effusion (OME) in children makes a comparative review of treatment modalities important. This study's objective was to compare the effectiveness of surgical strategies currently used for managing OME. METHODS: We identified 3 recent systematic reviews and searched 4 major electronic databases. Eligible studies included randomized controlled trials, nonrandomized trials, and cohort studies that compared myringotomy, adenoidectomy, tympanostomy tubes (tubes), and watchful waiting. Using established criteria, pairs of reviewers independently selected, extracted data, rated risk of bias, and graded strength of evidence of relevant studies. We incorporated meta-analyses from the earlier reviews and synthesized additional evidence qualitatively. RESULTS: We identified 41 unique studies through the earlier reviews and our independent searches. In comparison with watchful waiting or myringotomy (or both), tubes decreased time with OME and improved hearing; no specific tube type was superior. Adenoidectomy alone, as an adjunct to myringotomy, or combined with tubes, reduced OME and improved hearing in comparison with either myringotomy or watchful waiting. Tubes and watchful waiting did not differ in language, cognitive, or academic outcomes. Otorrhea and tympanosclerosis were more common in ears with tubes. Adenoidectomy increased the risk of postsurgical hemorrhage. CONCLUSIONS: Tubes and adenoidectomy reduce time with OME and improve hearing in the short-term. Both treatments have associated harms. Large, well-controlled studies could help resolve the risk- benefit ratio by measuring acute otitis media recurrence, functional outcomes, quality of life, and long-term outcomes. Research is needed to support treatment decisions in subpopulations, particularly in patients with comorbidities.\""
"\"A systematic review of the effect of tympanostomy tubes in children with recurrent acute otitis media.\",\"OBJECTIVE: Documentation of the effect of tympanostomy tubes in children with recurrent acute otitis media (RAOM) is limited. A recently published Cochrane review on the effect of tympanostomy tubes in children with RAOM was based on only two studies. Could the documentation be increased by including other randomized studies? METHODS: A MEDLINE and EMBASE search for randomized controlled trials was performed and 143 eligible papers were found. Only five studies could be included. All five were randomized studies with a total of 519 children, four randomized by children and one by ears. All five studies had different designs and control groups, making a proper meta-analysis impossible. Three studies had an antibiotic treated group, two studies a placebo group, and two studies a no treatment group as comparison group. Outcome measures were rates of AOM or fraction free of AOM in six or 12 months. RESULTS: Between two and five children have to be treated with tympanostomy tubes to prevent one child from attacks of acute otitis media (AOM) in six months. Tube treatment could reduce AOM with about one attack in six months after operation. Six months treatment with antibiotics was not different from treatment with tubes. No study reported quality of life for child and family or parental absence from day care or work. CONCLUSION: Insertion of tympanostomy tubes or long-term treatment with antibiotics seems to prevent one attack of AOM or keep one child out of three free from AOM in six months.\""
"\"Grommets (ventilation tubes) for hearing loss associated with otitis media with effusion in children\",\"BACKGROUND: Otitis media with effusion (OME; 'glue ear') is common in childhood and surgical treatment with grommets (ventilation tubes) is widespread but controversial. OBJECTIVES: To assess the effectiveness of grommet insertion compared with myringotomy or non-surgical treatment in children with OME. SEARCH STRATEGY: We searched the Cochrane ENT Disorders Group Trials Register, other electronic databases and additional sources for published and unpublished trials (most recent search: 22 March 2010). SELECTION CRITERIA: Randomised controlled trials evaluating the effect of grommets. Outcomes studied included hearing level, duration of middle ear effusion, language and speech development, cognitive development, behaviour and adverse effects. DATA COLLECTION AND ANALYSIS: Data from studies were extracted by two authors and checked by the other authors. MAIN RESULTS: We included 10 trials (1728 participants). Some trials randomised children (grommets versus no grommets), others ears (grommet one ear only). The severity of OME in children varied between trials. Only one 'by child' study (MRC TARGET) had particularly stringent audiometric entry criteria. No trial was identified that used long-term grommets. Grommets were mainly beneficial in the first six months by which time natural resolution lead to improved hearing in the non-surgically treated children also. Only one high quality trial that randomised children (N = 211) reported results at three months; the mean hearing level was 12 dB better (95% CI 10 to 14 dB) in those treated with grommets as compared to the controls. Meta-analyses of three high quality trials (N = 523) showed a benefit of 4 dB (95% CI 2 to 6 dB) at six to nine months. At 12 and 18 months follow up no differences in mean hearing levels were found. Data from three trials that randomised ears (N = 230 ears) showed similar effects to the trials that randomised children. At four to six months mean hearing level was 10 dB better in the grommet ear (95% CI 5 to 16 dB), and at 7 to 12 months and 18 to 24 months was 6 dB (95% CI 2 to 10 dB) and 5 dB (95% CI 3 to 8 dB) dB better. No effect was found on language or speech development or for behaviour, cognitive or quality of life outcomes. Tympanosclerosis was seen in about a third of ears that received grommets. Otorrhoea was common in infants, but in older children (three to seven years) occurred in < 2% of grommet ears over two years of follow up. AUTHORS' CONCLUSIONS: In children with OME the effect of grommets on hearing, as measured by standard tests, appears small and diminishes after six to nine months by which time natural resolution also leads to improved hearing in the non-surgically treated children. No effect was found on other child outcomes but data on these were sparse. No study has been performed in children with established speech, language, learning or developmental problems so no conclusions can be made regarding treatment of such children.\""
"\"Does early detection of otitis media with effusion prevent delayed language development?\",\"OBJECTIVE: To consider whether earlier detection of otitis media with effusion (OME) in asymptomatic children in the first 4 years of life prevents delayed language development. METHODS: MEDLINE and other databases were searched and relevant references from articles reviewed. Critical appraisal and consensus development were in accordance with the methods of the Canadian Task Force on Preventive Health Care. RESULTS: No randomised controlled trials assessing the overall screening for OME and early intervention to prevent delay in acquiring language were identified, although one trial evaluated treatment in a screened population and found no benefit. The \"\"analytic pathway\"\" approach was therefore used, where evidence is evaluated for individual steps in a screening process. The evidence supporting the use of tools for early detection such as tympanometry, microtympanometry, acoustic reflectometry, and pneumatic otoscopy in the first 4 years of life is unclear. Some treatments (mucolytics, antibiotics, steroids) resulted in the short term resolution of effusions as measured by tympanometry. Ventilation tubes resolved effusions and improved hearing. Ventilation tubes in children with hearing loss associated with OME benefited children in the short term, but after 18 months there was no difference in comparison with those assigned to watchful waiting. Most prospective cohort studies that evaluated the association between OME and language development lacked adequate measurement of exposure or outcome, or suffered from attrition bias. Findings with regard to the association were inconsistent. CONCLUSIONS: There is insufficient evidence to support attempts at early detection of OME in the first 4 years of life in the asymptomatic child to prevent delayed language development.\""
